{
  "catalog_version": 3,
  "generated_on": "2026-08-19",
  "verification": "Production entries passed metadata extraction and bounded byte-range probes using the plugin's native playback format policy.",
  "items": [
    {
      "id": "HJtLhTjEWAg",
      "title": "Norm Macdonald loves a challenge",
      "url": "https://www.youtube.com/shorts/HJtLhTjEWAg",
      "kind": "short",
      "category": "conan",
      "source_tier": "official",
      "enabled": true,
      "verified_on": "2026-08-19",
      "duration_seconds": 71,
      "width": 1080,
      "height": 1920
    },
    {
      "id": "9WZUa8AgLRk",
      "title": "Norm Macdonald rare old stand-up comedy",
      "url": "https://www.youtube.com/shorts/9WZUa8AgLRk",
      "kind": "short",
      "category": "standup",
      "source_tier": "fan",
      "enabled": true,
      "verified_on": "2026-08-19",
      "duration_seconds": 49,
      "width": 1080,
      "height": 1920
    },
    {
      "id": "v08En4wfqfI",
      "title": "The joke that almost got Norm fired from SNL",
      "url": "https://www.youtube.com/shorts/v08En4wfqfI",
      "kind": "short",
      "category": "weekend-update",
      "source_tier": "fan",
      "enabled": true,
      "verified_on": "2026-08-19",
      "duration_seconds": 35,
      "width": 1080,
      "height": 1920
    },
    {
      "id": "KnrWyN1Np1A",
      "title": "Norm roasting Conan and Jay Leno",
      "url": "https://www.youtube.com/shorts/KnrWyN1Np1A",
      "kind": "short",
      "category": "conan",
      "source_tier": "fan",
      "enabled": true,
      "verified_on": "2026-08-19",
      "duration_seconds": 44,
      "width": 1080,
      "height": 1920
    },
    {
      "id": "c2Ygq6owHj0",
      "title": "Norm Macdonald's SNL stories",
      "url": "https://www.youtube.com/shorts/c2Ygq6owHj0",
      "kind": "short",
      "category": "dennis-miller",
      "source_tier": "fan",
      "enabled": true,
      "verified_on": "2026-08-19",
      "duration_seconds": 37,
      "width": 720,
      "height": 1280
    },
    {
      "id": "cVqCeBSgFAE",
      "title": "Norm Macdonald's early stand-up comedy, part 2",
      "url": "https://www.youtube.com/shorts/cVqCeBSgFAE",
      "kind": "short",
      "category": "standup",
      "source_tier": "archive",
      "enabled": true,
      "verified_on": "2026-08-19",
      "duration_seconds": 46,
      "width": 720,
      "height": 1280
    },
    {
      "id": "rV4b-pZK7Q8",
      "title": "Norm's story about his uncle",
      "url": "https://www.youtube.com/shorts/rV4b-pZK7Q8",
      "kind": "short",
      "category": "conan",
      "source_tier": "fan",
      "enabled": true,
      "verified_on": "2026-08-19",
      "duration_seconds": 131,
      "width": 1080,
      "height": 1920
    },
    {
      "id": "4H7IQyRXYFA",
      "title": "Norm Macdonald's last stand-up set",
      "url": "https://www.youtube.com/shorts/4H7IQyRXYFA",
      "kind": "short",
      "category": "standup",
      "source_tier": "fan",
      "enabled": true,
      "verified_on": "2026-08-19",
      "duration_seconds": 40,
      "width": 1080,
      "height": 1920
    },
    {
      "id": "YB3gl74fm-g",
      "title": "Norm Macdonald on Conan: classic interview moment",
      "url": "https://www.youtube.com/shorts/YB3gl74fm-g",
      "kind": "short",
      "category": "conan",
      "source_tier": "fan",
      "enabled": true,
      "verified_on": "2026-08-19",
      "duration_seconds": 46,
      "width": 1080,
      "height": 1920
    },
    {
      "id": "r9ToRuM-P9c",
      "title": "Norm tells a joke written by a woman",
      "url": "https://www.youtube.com/shorts/r9ToRuM-P9c",
      "kind": "short",
      "category": "weekend-update",
      "source_tier": "fan",
      "enabled": true,
      "verified_on": "2026-08-19",
      "duration_seconds": 41,
      "width": 1080,
      "height": 1920
    },
    {
      "id": "AQlvYfveN3I",
      "title": "School",
      "url": "https://www.youtube.com/shorts/AQlvYfveN3I",
      "kind": "short",
      "category": "standup",
      "source_tier": "fan",
      "enabled": true,
      "verified_on": "2026-08-19",
      "duration_seconds": 60,
      "width": 1080,
      "height": 1920
    },
    {
      "id": "WpiQGrzR7ss",
      "title": "Another heater joke during Conan",
      "url": "https://www.youtube.com/shorts/WpiQGrzR7ss",
      "kind": "short",
      "category": "conan",
      "source_tier": "fan",
      "enabled": true,
      "verified_on": "2026-08-19",
      "duration_seconds": 34,
      "width": 720,
      "height": 1222
    },
    {
      "id": "nRAl17FOm8I",
      "title": "Norm trolls Sylvester Stallone over his movies",
      "url": "https://www.youtube.com/shorts/nRAl17FOm8I",
      "kind": "short",
      "category": "interview",
      "source_tier": "fan",
      "enabled": true,
      "verified_on": "2026-08-19",
      "duration_seconds": 60,
      "width": 1080,
      "height": 1920
    },
    {
      "id": "o83hLzNJEKI",
      "title": "Norm's first late-night television set",
      "url": "https://www.youtube.com/shorts/o83hLzNJEKI",
      "kind": "short",
      "category": "standup",
      "source_tier": "fan",
      "enabled": true,
      "verified_on": "2026-08-19",
      "duration_seconds": 98,
      "width": 1080,
      "height": 1920
    },
    {
      "id": "Ei0n8mN6z84",
      "title": "Norm didn't lose, he tied",
      "url": "https://www.youtube.com/shorts/Ei0n8mN6z84",
      "kind": "short",
      "category": "standup",
      "source_tier": "fan",
      "enabled": true,
      "verified_on": "2026-08-19",
      "duration_seconds": 60,
      "width": 1080,
      "height": 1920
    },
    {
      "id": "jkFvfh60rOQ",
      "title": "Wife in a coma",
      "url": "https://www.youtube.com/shorts/jkFvfh60rOQ",
      "kind": "short",
      "category": "conan",
      "source_tier": "fan",
      "enabled": true,
      "verified_on": "2026-08-19",
      "duration_seconds": 42,
      "width": 1080,
      "height": 1920
    },
    {
      "id": "nwcMgg8PhUY",
      "title": "The reason SNL fired Norm",
      "url": "https://www.youtube.com/shorts/nwcMgg8PhUY",
      "kind": "short",
      "category": "letterman",
      "source_tier": "official",
      "enabled": true,
      "verified_on": "2026-08-19",
      "duration_seconds": 58,
      "width": 1080,
      "height": 1920
    },
    {
      "id": "J--7B2QwzFE",
      "title": "Norm's eventful bed-and-breakfast stay",
      "url": "https://www.youtube.com/shorts/J--7B2QwzFE",
      "kind": "short",
      "category": "letterman",
      "source_tier": "official",
      "enabled": true,
      "verified_on": "2026-08-19",
      "duration_seconds": 177,
      "width": 720,
      "height": 1280
    },
    {
      "id": "fDrP-zhVM5o",
      "title": "Norm's favorite Dave joke",
      "url": "https://www.youtube.com/shorts/fDrP-zhVM5o",
      "kind": "short",
      "category": "letterman",
      "source_tier": "official",
      "enabled": true,
      "verified_on": "2026-08-19",
      "duration_seconds": 58,
      "width": 1080,
      "height": 1920
    },
    {
      "id": "Ms-N57s4h08",
      "title": "Norm breaks David Letterman",
      "url": "https://www.youtube.com/shorts/Ms-N57s4h08",
      "kind": "short",
      "category": "letterman",
      "source_tier": "fan",
      "enabled": true,
      "verified_on": "2026-08-19",
      "duration_seconds": 53,
      "width": 1080,
      "height": 1920
    },
    {
      "id": "K0RkT7LwbVQ",
      "title": "Professor of logic",
      "url": "https://www.youtube.com/shorts/K0RkT7LwbVQ",
      "kind": "short",
      "category": "conan",
      "source_tier": "fan",
      "enabled": true,
      "verified_on": "2026-08-19",
      "duration_seconds": 164,
      "width": 1080,
      "height": 1920
    },
    {
      "id": "Mlu2gXKoYR0",
      "title": "Two classic Weekend Update jokes",
      "url": "https://www.youtube.com/shorts/Mlu2gXKoYR0",
      "kind": "short",
      "category": "weekend-update",
      "source_tier": "fan",
      "enabled": true,
      "verified_on": "2026-08-19",
      "duration_seconds": 30,
      "width": 720,
      "height": 1280
    },
    {
      "id": "p0CbJjFNaBQ",
      "title": "Norm roasts Christie Brinkley",
      "url": "https://www.youtube.com/shorts/p0CbJjFNaBQ",
      "kind": "short",
      "category": "weekend-update",
      "source_tier": "fan",
      "enabled": true,
      "verified_on": "2026-08-19",
      "duration_seconds": 26,
      "width": 1080,
      "height": 1920
    },
    {
      "id": "_7ItdhaOeaQ",
      "title": "Norm's Madonna joke",
      "url": "https://www.youtube.com/shorts/_7ItdhaOeaQ",
      "kind": "short",
      "category": "weekend-update",
      "source_tier": "fan",
      "enabled": true,
      "verified_on": "2026-08-19",
      "duration_seconds": 22,
      "width": 1080,
      "height": 1920
    },
    {
      "id": "Lu6BoedFGew",
      "title": "The Swedish-German joke",
      "url": "https://www.youtube.com/shorts/Lu6BoedFGew",
      "kind": "short",
      "category": "conan",
      "source_tier": "fan",
      "enabled": true,
      "verified_on": "2026-08-19",
      "duration_seconds": 176,
      "width": 1080,
      "height": 1920
    },
    {
      "id": "WBbFgDug1XU",
      "title": "Norm on Michael Jackson's son",
      "url": "https://www.youtube.com/shorts/WBbFgDug1XU",
      "kind": "short",
      "category": "weekend-update",
      "source_tier": "fan",
      "enabled": true,
      "verified_on": "2026-08-19",
      "duration_seconds": 34,
      "width": 1080,
      "height": 1920
    },
    {
      "id": "PnchLaKyHck",
      "title": "George Washington",
      "url": "https://www.youtube.com/shorts/PnchLaKyHck",
      "kind": "short",
      "category": "standup",
      "source_tier": "fan",
      "enabled": true,
      "verified_on": "2026-08-19",
      "duration_seconds": 60,
      "width": 1080,
      "height": 1920
    },
    {
      "id": "R-B-mr0WQs4",